{
  "$schema": "./STUDIO_CAPABILITY_REGISTRY.schema.json",
  "registryVersion": "2.0.0-candidate",
  "status": "candidate-pending-live-validation",
  "project": "Card Engine",
  "studioCategory": "AI-native 2D game development studio",
  "truthPriority": [
    "latest implementation snapshot / live repository",
    "Figma for interface design",
    "generated code references",
    "canonical project documentation",
    "approved plans and decision records",
    "previous conversations",
    "general assumptions"
  ],
  "authority": {
    "human": {
      "owners": [
        "Raheem",
        "approved team members"
      ],
      "finalFor": [
        "creative direction",
        "product",
        "economy",
        "paid services",
        "destructive actions",
        "deployment",
        "subjective visuals",
        "studio conventions"
      ]
    },
    "studioLead": {
      "role": "primary Claude session",
      "owns": [
        "routing",
        "integration",
        "implementation",
        "verification coordination",
        "reporting",
        "documentation sync"
      ]
    },
    "specialists": {
      "role": "read-only recommendation",
      "cannot": [
        "edit",
        "write",
        "run shell",
        "spend",
        "ship",
        "create canonical truth"
      ]
    }
  },
  "workModes": {
    "FAST": {
      "criteria": [
        "isolated",
        "low risk",
        "exact canonical answer",
        "no cross-system decision"
      ],
      "specialistLimit": 0,
      "requiresWrittenProposal": false
    },
    "STANDARD": {
      "criteria": [
        "normal feature or production task",
        "one clear domain"
      ],
      "specialistLimit": 1,
      "requiresWrittenProposal": false
    },
    "FULL": {
      "criteria": [
        "new system",
        "cross-discipline",
        "schema",
        "economy",
        "major UX",
        "paid campaign",
        "runtime architecture"
      ],
      "specialistLimit": 2,
      "requiresWrittenProposal": true
    }
  },
  "evidenceVerdicts": {
    "PASS": "Objective criteria pass and no unresolved human gate remains.",
    "FAIL": "At least one objective acceptance criterion fails; evidence identifies where and why.",
    "HUMAN_REVIEW": "Objective checks pass or are inconclusive, and the remaining decision is subjective or product-level."
  },
  "agents": [
    {
      "name": "art-prompt-director",
      "sourcePath": ".claude/agents/art-prompt-director.md",
      "status": "revise",
      "portability": "provider-pack-configurable",
      "domains": [
        "image-engine",
        "portrait-art",
        "archetype-emblems",
        "leonardo"
      ],
      "trigger": "Before changing current Image Engine prompt architecture, portrait continuity rules, curated art pools, element visual language, Character Reference strategy, or emblem art direction.",
      "exclusions": [
        "provider 5xx errors",
        "prompt-string typo",
        "cost math",
        "environment plates",
        "PixelLab sprites"
      ],
      "requiredSources": [
        "IMAGE_ENGINE_REFERENCE.md",
        "card-engine-archetype-emblem-library.md",
        "CLAUDE.md",
        "live Image Engine source files"
      ],
      "historicalFailuresPrevented": [
        "rank identity drift",
        "emblem palette collision after paid generation"
      ],
      "type": "agent",
      "authority": "advisory-read-only",
      "toolPolicy": {
        "tools": [
          "Read",
          "Grep",
          "Glob"
        ],
        "disallowedTools": [
          "Write",
          "Edit",
          "NotebookEdit",
          "Bash"
        ],
        "model": "sonnet",
        "effort": "medium",
        "maxTurns": 8
      },
      "outputContract": [
        "RULING",
        "WHY",
        "RISKS",
        "RECOMMENDED ACTION",
        "CANONICAL SOURCES READ",
        "HUMAN DECISION NEEDED"
      ],
      "humanGates": [],
      "verification": [
        "Cite exact sources read",
        "Return a bounded recommendation",
        "Do not edit files or declare canonical truth"
      ]
    },
    {
      "name": "environment-art-director",
      "sourcePath": ".claude/agents/environment-art-director.md",
      "status": "active",
      "portability": "2d-production-pack",
      "domains": [
        "environment-art",
        "arenas",
        "plates",
        "props",
        "background-harness"
      ],
      "trigger": "Before generating/regenerating environment plates or scenery objects, or changing generation/finishing configuration.",
      "exclusions": [
        "character bodies",
        "card portraits",
        "Phaser collider math",
        "place lore meaning"
      ],
      "requiredSources": [
        "LEONARDO_PLAYBOOK.md",
        "HARNESS_INDEX.md",
        "bg-harness configs",
        "arena manifests",
        "CLAUDE.md"
      ],
      "historicalFailuresPrevented": [
        "framing fought with negatives",
        "self-contradictory prompts",
        "style-reference leakage",
        "color grade used instead of content revision"
      ],
      "type": "agent",
      "authority": "advisory-read-only",
      "toolPolicy": {
        "tools": [
          "Read",
          "Grep",
          "Glob"
        ],
        "disallowedTools": [
          "Write",
          "Edit",
          "NotebookEdit",
          "Bash"
        ],
        "model": "sonnet",
        "effort": "medium",
        "maxTurns": 8
      },
      "outputContract": [
        "RULING",
        "WHY",
        "RISKS",
        "RECOMMENDED ACTION",
        "CANONICAL SOURCES READ",
        "HUMAN DECISION NEEDED"
      ],
      "humanGates": [],
      "verification": [
        "Cite exact sources read",
        "Return a bounded recommendation",
        "Do not edit files or declare canonical truth"
      ]
    },
    {
      "name": "game-systems-designer",
      "sourcePath": ".claude/agents/game-systems-designer.md",
      "status": "active",
      "portability": "studio-core-configurable",
      "domains": [
        "balance",
        "stats",
        "ranks",
        "economy",
        "rewards",
        "ability-power-budget"
      ],
      "trigger": "Before open-ended numerical balance or mechanical-shape decisions.",
      "exclusions": [
        "exact canonical values",
        "renames",
        "routine bug fixes"
      ],
      "requiredSources": [
        "card-engine-power-system-spec.md",
        "card-engine-economy-currency-system-plan.md",
        "card-engine-ability-system-spec.md",
        "card-engine-boss-battle-spec.md",
        "live economy catalogs"
      ],
      "historicalFailuresPrevented": [
        "prices chosen from vibes",
        "archetype-specific shape that should be generic"
      ],
      "type": "agent",
      "authority": "advisory-read-only",
      "toolPolicy": {
        "tools": [
          "Read",
          "Grep",
          "Glob"
        ],
        "disallowedTools": [
          "Write",
          "Edit",
          "NotebookEdit",
          "Bash"
        ],
        "model": "sonnet",
        "effort": "medium",
        "maxTurns": 8
      },
      "outputContract": [
        "RULING",
        "WHY",
        "RISKS",
        "RECOMMENDED ACTION",
        "CANONICAL SOURCES READ",
        "HUMAN DECISION NEEDED"
      ],
      "humanGates": [],
      "verification": [
        "Cite exact sources read",
        "Return a bounded recommendation",
        "Do not edit files or declare canonical truth"
      ]
    },
    {
      "name": "lore-fantasy-director",
      "sourcePath": ".claude/agents/lore-fantasy-director.md",
      "status": "active",
      "portability": "card-engine-project-pack",
      "domains": [
        "lore",
        "archetypes",
        "story-pillars",
        "bosses",
        "factions",
        "codex",
        "flavor"
      ],
      "trigger": "Before proposing new narrative content or changing established character/world identity.",
      "exclusions": [
        "routine implementation",
        "questions already answered by canonical lore or code"
      ],
      "requiredSources": [
        "Character_Generation_Bible_Canonical_v1.md",
        "LORE_ENGINE_REFERENCE.md"
      ],
      "historicalFailuresPrevented": [
        "identity update without linked Bible value",
        "new path overlapping existing archetype territory"
      ],
      "type": "agent",
      "authority": "advisory-read-only",
      "toolPolicy": {
        "tools": [
          "Read",
          "Grep",
          "Glob"
        ],
        "disallowedTools": [
          "Write",
          "Edit",
          "NotebookEdit",
          "Bash"
        ],
        "model": "sonnet",
        "effort": "medium",
        "maxTurns": 8
      },
      "outputContract": [
        "RULING",
        "WHY",
        "RISKS",
        "RECOMMENDED ACTION",
        "CANONICAL SOURCES READ",
        "HUMAN DECISION NEEDED"
      ],
      "humanGates": [],
      "verification": [
        "Cite exact sources read",
        "Return a bounded recommendation",
        "Do not edit files or declare canonical truth"
      ]
    },
    {
      "name": "minigame-designer",
      "sourcePath": ".claude/agents/minigame-designer.md",
      "status": "revise",
      "portability": "studio-core-configurable",
      "domains": [
        "minigame-loop",
        "session-length",
        "difficulty-curve",
        "moment-to-moment-feel",
        "ability-hooks"
      ],
      "trigger": "For open-ended minigame-loop design decisions.",
      "exclusions": [
        "combat balance math",
        "routine implementation"
      ],
      "requiredSources": [
        "card-engine-power-system-spec.md",
        "card-engine-economy-currency-system-plan.md",
        "card-engine-boss-battle-spec.md",
        "card-engine-ability-system-spec.md",
        "CLAUDE.md"
      ],
      "historicalFailuresPrevented": [